{"$id":"host-runtime-observation-v0.schema.json","$schema":"https://json-schema.org/draft/2020-12/schema","additionalProperties":false,"properties":{"canonical_profile":{"const":"schuss-canonical-json-v1"},"configuration":{"additionalProperties":false,"properties":{"block_frames":{"maximum":512,"minimum":1,"type":"integer"},"output_channels":{"const":2},"render_frames":{"minimum":0,"type":"integer"},"sample_rate_hz":{"minimum":1,"type":"integer"}},"required":["sample_rate_hz","block_frames","render_frames","output_channels"],"type":"object"},"content_hash":{"pattern":"^sha256:[0-9a-f]{64}$","type":"string"},"device":{"oneOf":[{"additionalProperties":false,"properties":{"status":{"const":"not-opened"}},"required":["status"],"type":"object"},{"additionalProperties":false,"properties":{"audio_device_name":{"minLength":1,"type":"string"},"midi_input_count":{"minimum":0,"type":"integer"},"status":{"const":"opened"}},"required":["status","audio_device_name","midi_input_count"],"type":"object"},{"additionalProperties":false,"properties":{"reason":{"minLength":1,"type":"string"},"status":{"const":"unavailable"}},"required":["status","reason"],"type":"object"}]},"diagnostics":{"items":{"additionalProperties":false,"properties":{"code":{"pattern":"^[A-Z][A-Z0-9_]+$","type":"string"},"message":{"minLength":1,"type":"string"},"severity":{"enum":["error","warning","info"]}},"required":["code","severity","message"],"type":"object"},"type":"array","x-schuss-array-kind":"sequence"},"evidence_boundary":{"additionalProperties":false,"properties":{"audible_level_8_promoted":{"const":false},"host_execution_only":{"const":true},"ksoloti_equivalence_claimed":{"const":false},"real_time_level_7_promoted":{"const":false},"release_readiness_claimed":{"const":false}},"required":["host_execution_only","real_time_level_7_promoted","audible_level_8_promoted","ksoloti_equivalence_claimed","release_readiness_claimed"],"type":"object"},"metrics":{"additionalProperties":false,"properties":{"callback_cpu_ratio_max":{"pattern":"^[0-9]+(?:\\.[0-9]+)?$","type":"string"},"callback_duration_us_max":{"minimum":0,"type":"integer"},"midi_events_delivered":{"minimum":0,"type":"integer"},"processed_frames":{"minimum":0,"type":"integer"},"queue_overflows":{"minimum":0,"type":"integer"},"xruns":{"minimum":0,"type":"integer"}},"required":["processed_frames","midi_events_delivered","queue_overflows","xruns","callback_cpu_ratio_max","callback_duration_us_max"],"type":"object"},"observation_kind":{"enum":["offline-render","local-real-time-smoke"]},"output":{"additionalProperties":false,"properties":{"byte_length":{"minimum":0,"type":"integer"},"byte_sha256":{"pattern":"^[0-9a-f]{64}$","type":"string"},"media_type":{"const":"audio/wav"}},"required":["media_type","byte_length","byte_sha256"],"type":"object"},"package_content_hash":{"pattern":"^sha256:[0-9a-f]{64}$","type":"string"},"schema_version":{"const":"host-runtime-observation-v0"},"status":{"enum":["success","failed","unavailable"]},"toolchain":{"additionalProperties":false,"properties":{"compiler_id":{"minLength":1,"type":"string"},"compiler_version":{"minLength":1,"type":"string"},"runtime_abi":{"const":"schuss-rt-abi-v0"},"target_triple":{"minLength":1,"type":"string"}},"required":["compiler_id","compiler_version","target_triple","runtime_abi"],"type":"object"}},"required":["schema_version","canonical_profile","content_hash","observation_kind","status","package_content_hash","configuration","device","toolchain","output","metrics","diagnostics","evidence_boundary"],"title":"Schuss bounded host runtime observation v0","type":"object"}
