{"canonical_profile":"schuss-canonical-json-v1","configuration":{"block_frames":127,"output_channels":2,"render_frames":48000,"sample_rate_hz":48000},"content_hash":"sha256:bc6c4f0417508971f9ea04f4913beb794cd5110a5bf84f6814ea3c3d32f877e2","device":{"status":"not-opened"},"diagnostics":[],"evidence_boundary":{"audible_level_8_promoted":false,"host_execution_only":true,"ksoloti_equivalence_claimed":false,"real_time_level_7_promoted":false,"release_readiness_claimed":false},"metrics":{"callback_cpu_ratio_max":"0.000000","callback_duration_us_max":0,"midi_events_delivered":0,"processed_frames":48000,"queue_overflows":0,"xruns":0},"observation_kind":"offline-render","output":{"byte_length":192044,"byte_sha256":"ae2b8eff76d079b85c74f4d33d555699f8812cb0b72ea459014ee9a90e9ead7c","media_type":"audio/wav"},"package_content_hash":"sha256:a18ee43608514571768e636f8e8600d0cb38b4109b86f789451160233bc7fc70","schema_version":"host-runtime-observation-v0","status":"success","toolchain":{"compiler_id":"AppleClang","compiler_version":"16.0.0 (clang-1600.0.26.6)","runtime_abi":"schuss-rt-abi-v0","target_triple":"arm64-apple-darwin"}}
